{
  "id": "conformance-capability-missing",
  "name": "Conformance: Capability Missing (G23 dispatch refusal)",
  "version": "1.0.0",
  "description": "Single-node workflow whose node declares `requires: ['conformance.never-provided']`. The engine MUST refuse to dispatch the node and terminate the run with `error.code = 'capability_not_provided'`. Spec: spec/v1/capabilities.md §'Runtime capabilities (future)' + docs/WORKFLOW_ORCHESTRATION_GAPS.md §G23.",
  "nodes": [
    {
      "id": "n1",
      "typeId": "conformance.requiresMissing",
      "name": "Requires Missing",
      "position": { "x": 0, "y": 0 },
      "config": {},
      "inputs": {}
    }
  ],
  "edges": [],
  "triggers": [
    { "id": "manual", "type": "manual", "enabled": true }
  ],
  "variables": [],
  "metadata": { "tags": ["conformance", "G23", "capability-not-provided"] },
  "settings": { "timeout": 10000, "maxRetries": 0 }
}
